{
  "$schema": "./_schema.json",
  "slug": "nola",
  "name": "New Orleans",
  "subdomain": "nola",
  "state": "LA",
  "timezone": "America/Chicago",
  "status": "setup",
  "center_lat": 29.9511,
  "center_lng": -90.0715,
  "radius_miles": 30,
  "sms_did": "4049137292",
  "sms_area_code": "504",
  "min_drivers_to_launch": 5,
  "branding": {
    "slang": { "match": "HMU", "confirm": "Pull Up" },
    "tagline": "Make Bank Trips not Blank Trips"
  },
  "clone_cms_from": "atl",
  "areas": [
    { "slug": "french-quarter",    "name": "French Quarter",     "cardinal": "central",   "sort_order": 1  },
    { "slug": "cbd",               "name": "CBD",                "cardinal": "central",   "sort_order": 2  },
    { "slug": "mid-city",          "name": "Mid-City",           "cardinal": "central",   "sort_order": 3  },
    { "slug": "marigny-bywater",   "name": "Marigny / Bywater",  "cardinal": "eastside",  "sort_order": 4  },
    { "slug": "new-orleans-east",  "name": "New Orleans East",   "cardinal": "eastside",  "sort_order": 5  },
    { "slug": "uptown",            "name": "Uptown",             "cardinal": "westside",  "sort_order": 6  },
    { "slug": "garden-district",   "name": "Garden District",    "cardinal": "westside",  "sort_order": 7  },
    { "slug": "kenner",            "name": "Kenner",             "cardinal": "westside",  "sort_order": 8  },
    { "slug": "msy-airport",       "name": "MSY Airport",        "cardinal": "westside",  "sort_order": 9  },
    { "slug": "lakeview",          "name": "Lakeview",           "cardinal": "northside", "sort_order": 10 },
    { "slug": "metairie",          "name": "Metairie",           "cardinal": "northside", "sort_order": 11 },
    { "slug": "algiers-westbank",  "name": "Algiers / Westbank", "cardinal": "southside", "sort_order": 12 }
  ]
}
